{
  "schema_name": "ncls.training-config",
  "schema_version": 6,
  "pipeline_id": "target-encoder-initialization-bounded-refinement-e2@1",
  "research_stage": "e2-shared-representation-capacity",
  "model_parameters": {
    "latent_dimension": 16,
    "encoder_width": 32,
    "encoder_layer_count": 1,
    "refinement_bound": 0.25,
    "width": 108,
    "prepare_layer_count": 1,
    "evaluate_layer_count": 4,
    "activation": "gelu",
    "direction_encoding_id": "ncls.multiscale-half-slope-directions@1",
    "fourier_band_count": 1,
    "output_bias": 0.0
  },
  "dataset_selection": {},
  "steps": 500,
  "batch_size": 16,
  "learning_rate": 0.01,
  "learning_rate_schedule": "cosine",
  "final_learning_rate_fraction": 0.05,
  "weight_decay": 0.0,
  "gradient_clip": 5.0,
  "validation_interval": 50,
  "checkpoint_interval": 100,
  "max_validation_query_groups": 96,
  "seed": 20260824,
  "device": "cuda",
  "deterministic": true,
  "selection_metric": "solid_angle_normalized_l1.median",
  "initialization_checkpoint": "artifacts/research/learning-goal/e2/runs/target-tensor-encoder-capacity-v1/checkpoints/best.pt"
}
